index,asin,url,title,price,description
91,B00IY408BA,https://www.amazon.com/dp/B00IY408BA,Complete Guide for Leadership Training: Developing Leadership Skills and How To Take the Lead,2.99,"Investing In your Employees Can Offer big Payoffs!. Read on your PC, Mac, smart phone, tablet or Kindle device.Are you at a loss for how to develop more team spirit at your business? Are there too many supervisors and not enough valuable workers that care about the final outcomes of performance? This book will show you how easy it is to bring a simple, yet fun leadership skills training program to all of your employees.Why would you offer leadership training to everyone? Isn’t that a management class? No! There are should be numerous employees with strong leadership qualities that can contribute in many ways to the success and dynamic of your business. Download this book TODAY and find out: How to introduce the importance of leadership skills How to teach leadership skills How to get EVERYONE involved How to follow up after the classDevelop strong leadership qualities in all of your employees by downloading this book NOW!Download your copy today!To order, click the BUY button and download your copy right now!Tags: leadership skills, how to take the lead, how to be in control, developing leadership skills, successful leadership skills, leadership techniques, leadership training"
92,B00BADY7MS,https://www.amazon.com/dp/B00BADY7MS,The Couponing Guide: A Mom's Guide to Couponing,2.99,"Are you looking to save money by cutting down your monthly bills?Couponing is one of the most profitable side hobbies that can provide real savings to your family budget immediately. As a real mom who uses couponing to make ends meet, I have written this guide to help those just getting started and those looking to become effective couponers. Here are some of the things you will learn:What is couponing?Basic rules for couponingHow to differentiate between different types of couponsSuccessful coupon hunting strategiesHow to effective organize your couponsHow to take your couponing to the next levelThe best couponing resources to get started today!Couponing is not hard to learn, but it is difficult to master. This couponing guide will provide all the lessons that I have learned the hard way. Start saving money today by learning how to coupon like a pro!"
93,B008TAW6KA,https://www.amazon.com/dp/B008TAW6KA,"How I Made Over $1 Million Using The Law of Attraction: The Last Law of Attraction, How-To, Or Self-Help Book You Will Ever Need To Read (Law of Attraction Series)",2.99,"Have you been searching for that ""Something"" that's going to finally change your life. Book after book, cd program after cd program. The workshops, the webinars...The never-ending e-mails...The PROMISES!I've read all the books...I've listened to the CD's...I've been to the workshops and seminars...And you know what? I finally got this stuff to work for me. And it turned out to be pretty easy! I figured out why people struggle with these ideas and concepts, and decided to help all the people who need it by writing an inexpensive book about what worked for me, and explaining it in the simplest way possible! Now it's your turn!It's finally time to have a truly AMAZING life!  The life that you dream about having. The life that you deserve, and the things you want in that life.This book was written for YOU! It's simple.It's clear.It's what You need!And it's written by someone who used the same methods and techniques contained in the book, and became successful, healthy, and happy.I've had incredible success with the Law of Attraction and Self-Help. This book is my way to help all those people who desire wealth, health, and happiness!This book is written in a simple, no-nonsense style so that you can immediately start making changes in your life, and manifesting those dreams you've always desired."
94,B00FCYITZM,https://www.amazon.com/dp/B00FCYITZM,"Organize Your Life, How To Be Organized, Productive & Happier In Life,Declutter Your Home and Be Productive at Work. (How to plan your life, Get Organized Book 1)",3.13,"""""Do you wish to be organized and have more space in your mind, your office or your home?  Get ready, this book will change your life.  If you're looking for a real, proven step-by-step solution to organize everything --so you can finally live an amazing stress free life and be productive--then this book is for you.  Do you want to change your life, but don’t know where to start?   We all have many goals and ambitions in life. But regardless of what we wish to achieve, one thing that is common is the way in which we pursue it.Some of us seem to always get what we go after, but some struggle throughout their lives and are running on the wrong tracks. I'll say they cannot find the right way, simply because that’s how it is. It's not because they don’t want to, or don’t try enough, but simply can't figure out the right approach toward their ambitions.  I will not pretend to be a guru to say I know answer to this. But there is one thing that can help a lot when trying to achieve your goals. I’m sure that you will back me up on this one, because you must have read it or known it before, and many of you probably felt the advantages of it too.  Organize Your Life  Yes, Organize your life and take that key step in your pursuit for more productive and stress free lifestyle.  If you can master this skill & be organized in every aspect of your life, then you will be UNSTOPPABLE. You will become more productive, consistent and achieve all your goals.  A Quick Glance At What To Expect... How To Organize Everything In Your Mind Importance Of Setting Priorities & Using Planner  Is Procrastination Your Toughest Enemy  How To Be Organized At Work How To Be Organized At Home How To Find Place For Everything In Your Closet How To Plan Tomorrow & Write Your Own DestinyMuch, much more!  Check out what others are saying  Perfectionist!! Jennifer Rai (Nanaimo, BC, Canada) I'm a complete perfectionist! Which leaves me with a lot of weight on my shoulders and stress. This book targets all types of people and I love how I could take things out of 'Organize your life' and use them to my advantage.  Easy to follow !! Marshall Hanks (USA) If you're in need of organization, then this is the book for you. It doesn't matter if you are mentally disorganized, emotionally, domestically, or at work--this book will guide you through the necessary steps.  Great Practical Guide!! Simone Lea (New York) This was an awesome and very practical guide for Organizing your life. I really enjoyed reading it, and have found its instructions quite easy to follow.  Add to cart now   TAGS : how to organize your life,how to organize just about everything,how to organize yourself,how to organize my house,how to organize your closet,how to organize kindle,how to organize kindle books,how to organize free,organize now,organize your life,organize your mind organize your life,organize yourself,organized home,organized at work,how to organize work"
95,B00BWHVU6S,https://www.amazon.com/dp/B00BWHVU6S,,,
96,B00A538QJO,https://www.amazon.com/dp/B00A538QJO,Fear and Loathing and Short Sales (Fear and Loathing Short Sales Book 1),2.99,"Fear and Loathing and Short Sales: Agent's Guide from a Loss Mitigation PerspectiveHave you been hesitant to list a short sale or have you been referring short sales work away to other real estate agents? Do you avoid or dislike residential Short Sales? Would you like to have proven methods to make money from residential Short Sales?Today many of the homes that are sold, needed a Short Sale in order to transfer. According to Alex Charfen, and other short sales experts, this trend is not going away.While there are good Short Sales materials available, none have been written from the loss mitigation perspective. Author, Melanie Riekena, has been a broker and a banker-trained loss mitigator and bridges the ""worlds"" between real estate and asset management or default servicing.This book is written for real estate agents to help them understand, specialize and close their short sales. It includes:- How to determine which Short Sale program their clients belong in- Suggestions for an Outstanding Listing Presentation that will set you apart- What are the business benefits for specializing in Short Sales- Short Sales program requirements, flow charts, and documents required- What you should be doing, and When- How to influence the Bank's decision and obtain Approval Letters- What business practices to implement so you can handle VOLUME Short Sales and still have a life- Negotiation Points- the Loss Mitigation, or Bank's perspective- How this niche market ban be a money maker for you- How to take market share in your region- and much MORE!In this book, Melanie Riekena shows you EXACTLY how to approach home Short Sales so that you can be a distressed property expert, and maintain a very high probability of closing successfully on every short sale you list. Whether you've been afraid to do a Short Sale, or tried them and didn't like the outcome, or if you already specialized, you'll benefit from this 40-ish page book.  It is jam packed with vital information that is only available from knowledge of both Real Estate brokerage, loss mitigation and wide-spread experience of settling almost 3000 defaulting loans. Stop the fear and loathing and start making good money from residential short sales. Get your copy today!"
97,B00EC4MF0S,https://www.amazon.com/dp/B00EC4MF0S,,,
98,B00B5HJBN4,https://www.amazon.com/dp/B00B5HJBN4,The Birth Of A Freelance Blogger: How To Write An Engaging Blog Post... Fast Like Freddy,2.99,"Amazon Bestseller Shares How To Write An Engaging Blog Post... Fast Like Freddy""How To Write An Engaging Blog Post... Fast Like Freddy"" will teach you:How To Write An Engaging Blog Post... FastWriting an engaging blog post has 4 main objectives:To captivate and grab your reader's attention,To persuade your reader to keep reading the rest of the article,To provide the best possible value to your reader,To build credibility and trust within your reader's mind,To become an authority to your reader within the area of interest at hand.How To Prepare Before Writing Any Blog Post - ResearchResearching your blog post starts right at where your blog post will be published to. This step comes even before you have a topic in mind for the post.How To Find The Best Possible Topic For Your Blog Post That Guarantees Engagement From Your ReaderSubjecting your reader to change when they don't need or want to, will most likely cause your blog post to fail horribly. Instead, focus on what they are already comfortable with and give it to them in more detail.How To Structure The Perfect Engaging Blog PostGetting this step mastered will not only result in you getting your message across in the most engaging way possible, but it will also have you write the actual blog post at the speed of writing light.How To Start A Blog PostTwo of the most critical elements of an engaging blog post is your title and the hook right at the beginning. These two determine whether I will read your post or not. Period. Knowing how to start a blog post will ensure you have your reader's full attention for the rest of the article. How To Compose The Perfect Body Of An Engaging Blog Post That SellsHow to write a blog post that sells does not necessarily mean you need to shove a product down your reader's throat and have them digg out their last few dollars to pay you.However, thoughout the blog post you will be selling your reader. You need to either a.) sell them on your opinion or idea, b.) sell them on a common problem they have, or c.) a pleasure they want but don't yet have and d.) finally you'll need to sell them on the solution that you are going to provide to them.How To End The Perfect Engaging Blog PostThe final stages of the blog post needs to engage the reader even further. This engagement will lead to some form of action, which may include further engagement, an event taking place, a training course being offered, a product being offered etc.**BONUS***Included in this guide is what I call the ultimate psychology blog post structure, complete with a detailed infographic for easy reference.About The AuthorRuan Oosthuizen started his online ventures after quitting his Systems Admin job in August 2011.Guest contributions to a number of authority sites taught Ruan many tricks in the trade of guest blogging, starting at the back-end with custom HTML and CSS design, through to writing engaging content."
99,B00HS8YV66,https://www.amazon.com/dp/B00HS8YV66,6 Figure Freedom: Simple & Effective Steps To Guide You To Real Estate Success,1.99,"Have you seen any of those shows on TV about flipping houses? Have you wondered how they do it? Have you or one of your friends been talking about flipping houses for a long time but that’s all it is – talk? Well, stop talking about it and get involved. There is so much real estate out there, it is time for you to take your claim.      This is not a 395-page book of regurgitated information from a bunch of gurus. This is a bit of background, life experiences, and case studies from an expert of real estate investing. The relatable case studies and principles of this book will allow you to go out and start doing deals immediately. If you’re an experienced investor, maybe you will learn a different technique you haven’t tried.     This is not for you if you are a quitter, don’t want to make a better lifestyle for yourself, or don’t want financial freedom. This is also not for you if you think this is a get rich quick scheme. This book has the potential to get you from where you are to where you want to be as a real estate investor at an exponential pace! Scroll up and get your copy now! This is your opportunity to look into a successful real estate investors business!"
100,B00B76A8G2,https://www.amazon.com/dp/B00B76A8G2,"Grow It, Build It, Save It! How one family saves over $11,000 each year, and you can too!",2.99,"Do you find yourself living paycheck to paycheck? Do you wonder where your money went at the end of each month? You are not alone! Grow It, Build It, Save It! explains how one family changed their terrible behaviors with money and now save over $11,000 each year! Each chapter offers a detailed explanation of a saving strategy that the author and her family have implemented in their journey to financial security. Don't let money stress you out! Take the tips and tricks outlined in this book and start making progress today!"
101,B00J77PRN2,https://www.amazon.com/dp/B00J77PRN2,,,
102,B00A6HLD30,https://www.amazon.com/dp/B00A6HLD30,Forex Range Trading With Price Action - Forex Trading System,7.99,"Forex Range Trading With Price ActionLucrative price action range trading system with 95% rate of successTimeframes -  1 hours and 4 hoursIf you trade with the trend like the majority of traders out there, then you probably know by now that following the trend and jumping in the market when a good opportunity shows itself represents the safest and most lucrative approach a trader can have if he wants to be successful. However, most of the times, a problem appears when the trend pauses and the market starts to move sideways, causing so many trend following traders to lose most or all of their previous hard earned profits.This book presents a complete forex trading system for trading a range bound market. It goes from explaining how to spot in time that price is about to develop a trading range, to managing your stop loss levels and exiting the trade. This is all done just by reading the price action, this system does not include any technical indicators.You will learn how to recognize early the shift from trending to sideways movement that will keep you away from losing trades.You will learn how to identify a range early and trade it successfully, with clear entry, stop loss, exit levels and with very good risk reward ratio."
103,B00HYFHISQ,https://www.amazon.com/dp/B00HYFHISQ,,,
104,B00BT7DZI2,https://www.amazon.com/dp/B00BT7DZI2,Connect to Authentic Success: 7 Steps to the Destiny You Deserve,6.75,"FREE BONUSES: MP3 Mind Relaxation Program, Bonus Resources Tool Kit – MP3’s and Downloadable Tools. Details inside book. DESCRIPTIONREVIEW - by 3rdi Business Magazine:Connect to Authentic Success is by Amanda Steadman who is a speaker, author, trainer and serial entrepreneur.This book is what it asks us to be: focussed. It provides a clear and concise path for us to follow if we want to achieve success. Amanda is not in the least prescriptive about what success might mean; she leaves us to work it out for ourselves. However she is clear that that for her, working out how to be doing something you love and having time left over for the people who are important to us, is what she wants to achieve for herself.The book sets out clearly how we can go about being successful but it is not all about process. It is also about using our emotions intelligently, in the process.The book’s claim is to: “Learn how you can get what you want using easy, proven and tested success strategies you can implement instantly!”It is not just about the approach being mechanical. We need an approach which leaves us feeling good about ourselves and our work and also lets us have other priorities too.We get a bonus chapter called ‘The Chocolate Effect’, which immediately made me want to read it! However, it is the Action Station at the end of each chapter, which is the meat of the book(plus very useful bonus resources) Anne Casey CONNECT TO AUTHENTIC SUCCESS WILL HELP YOU TO:•Gain absolute clarity on what you do and don’t want in your life and business•Increase your personal power, energy and confidence•Increase intuitive decision making•Minimize stress and frustration•Develop a new way to manage emotions and approach daily challenges  effectively•Raise your levels of awareness and increase all opportunities, synchronicities and prosperity•Know what your purpose is so, you can build an authentically successful career or business AROUND IT! Make your soul smile -  :  )PRAISE“This wonderful, inspiring book takes you by the hand and walks you through every step you need to take to live an extraordinary life.- Brian Tracy, International Best Selling Author, Change Your Thinking, Change Your Life and 52 other titles, 2011 Lifetime Achievement Award- National Academy of Best-Selling Authors. “Connect to Authentic Success is a must read. Amanda shares with you all her secrets from despair to success and how you can avoid mistakes that lead to stress, dissatisfaction and lack of fulfillment. Follow her step-by-step formula that will lead you to the happiness and confidence you will experience by claiming your true destiny.”- Peggy McColl, “The Best Seller Maker”, New York Times Best-Selling Author“Playing by the old school rules is a thing of the past. Today we are able to create our life according to who we are called to be. Amanda takes readers on a journey of self-discovery and combines one’s practical self with their visionary self. A great read for anyone who is looking for clear direction for their life.”-Kathleen Gage - Online Expert, Power Up For Profits“She attracts an awesome crowd of individuals to work with. Her book is an extension of this and she provides practical solutions to some of the biggest challenges facing many people at the moment. This book will not only inspire you, but give you specific actionable ways to maximize your personal potential and make your life and business work for you.”- Daniel Hall, Author, Speaker, Lawyer and Online Product Expert“Finally, there is a book on success written from the soul. Start in your heart. Amanda deserves all the success in her life and now leaves clues; she shares her secrets with those willing to read the book and take the action. Be the star in your own story!”- Bobby Gill, Writer, Internet Genius & Super Supporter, UKDOWNLOAD YOUR FREE BONUS RESOURCES - All the information is in the book. To your successAmanda Steadman#1 Amazon Best Seller"
105,B008Y89NG2,https://www.amazon.com/dp/B008Y89NG2,30 Free E-Commerce Tools:  No Cost Software Tools to Build Your E-Commerce Empire without Going Broke,2.99,"Starting an e-commerce business can be done successfully with a very small investment, but unexpected costs can blow the budget if you're not careful.  Fortunately, there is a free tool for just about every job an e-commerce store owner must perform from keyword research and competitive analysis to graphics design and email marketing.In this concise guide, the author of ""E-Commerce Blueprint:  The Step-by-Step Guide to Online Store Success"" exposes 30 FREE software tools you can add to your e-commerce arsenal to dominate the competition.  Learn how to get:-  A powerful free graphics design package on par with Adobe Photoshop-  Where to create unlimited, free professional logos -  7 free keyword research tools-  free competitive analysis tools-  free and powerful social media management tools-  free stock photography for commercial use-  free infographics-  free audio and video editing tools-  free analytics tools-  free email marketing tools -  free chat softwareFor less than the cost of a burger, you'll discover amazing free alternatives to expensive software and subscriptions that can cost you hundreds.  The smart e-commerce store owner needs to operate with low overhead. This book is ""the research"" done for you. It covers nearly every type of tool an e-commerce store owner needs and more.  Don't waste time surfing for the right tool for the job.  Let me tell you what you need and exactly how to get it.These 30 Free E-Commerce Tools are just the ticket to minimize your costs as your grow your online business.  The secrets in this book are not just for e-commerce entrepreneurs.  If you have a blog, do affiliate marketing or generate revenue online in any way, you're sure to benefit from the information contained in this book.So grab your copy off ""No Cost Software Tools to Build Your E-Commerce Empire without Going Broke"" and get start trimming your e-commerce business budget today."
106,B008AC6LJY,https://www.amazon.com/dp/B008AC6LJY,"Five Year Life - Don't Start ANY Relationship, New Job or Career Before Answering These Pivotal 82 Questions About You!",2.99,"#1 Amazon Bestseller In Job Hunting!#1 Amazon Bestseller In Personal Transformation!Don't Start ANY Relationship Or New Career Before Answering These Pivotal 82 Questions!Take Control - Discover How To Define YOUR Future Life - Define Your Future Point BAre you someone making major life changes such as: students andgraduates; those who are dating, marrying or divorcing; those who arejob hunting, have lost their job, changing careers or starting their own business; those who are seeking personal transformation or who arere-evaluating their lives for a variety of other reasons?If so, then this book will be especially meaningful to your present and future.After three decades of experience pursuing my mission of helpingfolks get to their Point B, I've learned a few axioms of life that Iwant to share with you:Too many folks never consider that they have control of their owndestiny. As a result, they never know where they're going - and they end up taking too many dead-end trails that lead to nowhere because theynever understood they had the right and the ability to choose theirPoint B.Too many folks procrastinate even the micro-decisions that affecttheir life path. As a result, they are frozen by indecisiveness when itcomes to the big decisions because they never take responsibility fordefining their own Point B.Too many folks consider two weeks to be long term planning. As aresult, they end up making reflex decisions that get them off the rightpath because they never defined their right Point B past a two-weektimeline.If you are already in a long-term relationship, you and yoursignificant-other need to have a similar desired Point B destination and a shared path to reach it.If you don't share the same Point B, at some other point your pathswill probably go different directions - with the result that each of you may end up going your separate ways.You and your career goals need to have a similar desired Point Bdestination. If you are even considering starting a company, your veryfirst decision needs to be your definition of the right-for-you personal Point B. Not everyone is cut out to be an entrepreneur - and it maymake a lot more sense for you to work for someone else. Even then, yourcareer decisions need to be congruent with your personal Point B.The choice between starting and running a company - versus workingfor someone else's company will depend upon what is right for you. Buteither way, your personal desired Point B needs to be on the same pathas your business Point B -- or you will have dragons galore that willneed to be slayed on a regular basis.Five Year Life is a short workbook that will quickly guide you through 82 pivotal questions.Because these issues are so important to virtually everyone's life, I want to offer this Workbook at an affordable price to everyone - so you can realistically take control of your life and find the congruent path to your own fulfilling personal Point B.Unless you know where you WANT to go in your personal life, it'sgoing to be difficult to make a lot of the right business and personaldecisions that you will face every day, week and year between now andfive years from now.Take this 82 Question Quiz today - and discover exactly what is important to YOUR Five Year Life!"
