index,asin,url,title,price,description
162,B0098PUCOW,https://www.amazon.com/dp/B0098PUCOW,The Great Leadership Development and Succession Planning Kit: Part One,7.49,"The Great Leadership Development and Succession Planning Toolkit is a “best of” collection of blog posts from the award winning blog Great Leadership, written by Dan McCarthy, an experienced leadership development practitioner and author.Over the years Dan has established a reputation as a shrewd commentator on the state of leadership in contemporary management. As an executive himself Dan writes from the point of view of what organizations and managers must do to ensure that they do what is right for their organization by developing the talents and skills of their employees. Now in The Great Leadership Development and Succession Planning Kit, Dan has gathered these lessons in one volume that is a must-read for anyone who manages anyone else. The posts have been edited and organized as a user-friendly “toolkit”, with easy to follow step-by-step tips, instructions, templates, and practical advice.It is intended to be used by leadership development practitioners, HR pros, coaches, consultants, leaders and aspiring leaders as a “do-it-yourself” resource for leadership development and succession planning.The content is organized into five sections:Section one, “The Foundation”, provides an overview of succession planning and leadership development.  It also includes information on how to create a business case for leadership development, a leadership development strategy, and a leadership competency model.Section two is all about succession planning. It includes detailed guidelines for how to create a talent profile, identify critical positions and talent pools, how to identify and manage high potentials, and how to use a performance and potential matrix (a “nine box”) in a talent review meeting.While many organizations and managers do an adequate job in succession planning, many fall short when it comes to the development of their employees. Section three is a comprehensive collection of proven methods used to develop great leaders. It includes individual development planning, giving and receiving feedback, new manager integration, stretch assignments, learning journals, assessments, off-the-job development, how to develop a leadership development training program, involving leaders, how to measure the impact, and much more.Section four is a collection of easy-to-follow guidelines and tips on how to improve critical leadership skills. It includes how to develop leadership presence, strategic thinking, critical thinking, inspiring trust, creating a motivating environment, improving performance, managing global virtual teams, building optimism, having effective one-on-ones, financial literacy, how to lead a team meeting, and more.Finally, section five includes two must-have leadership development templates, free to use and reproduce: an individual development plan (IDP) and a performance and potential matrix (nine-box)."
163,B00JIBFYR6,https://www.amazon.com/dp/B00JIBFYR6,"How to Start a Business: The Ultimate Guide on How to Create Your Own Successful Business (Start a Business, Marketing, Advertising)",2.99,"Discover How To Start Your Very Own BusinessToday only, get this Amazon bestseller for just $2.99. Regularly priced at $4.99. Read on your PC, Mac, smart phone, tablet or Kindle device.You’re about to discover how to create your own successful business. Whether you are just starting or are already running, there is something to be learned from this book. It not only acts as a great guide, but really makes you think about the important questions that you should be asking yourself. If you are unsure what type of business that you want to start, you will definitely have a direction at the end of this book. It's packed with tips and secrets that will take your business to the top!Lots of businesses open and close quickly after because they didn't have a good strategy to begin with. This book will encourage to think about your long term goals and how to make your business successful long term. Starting a business is a daunting task to some, but after reading this book you will have the confidence to get out there and start making money!Here Is A Preview Of What You'll Learn...What type of business do I want to start?What does it take to run a business?How to build your teamHow to make your business profitable long termLow Start Up Cost Business IdeasMarketing StrategiesMuch, much more!Download your copy today!Take action today and download this book for a limited time discount of only $2.99! Start your new business today!Tags: how to start a business, home based business, start business from home, how to start a business with no money, business startup, become an entrepreneur, entrepreneurship, types of business, how to increase sales, marketing, business marketing, how to market your business"
164,B00LK00W5W,https://www.amazon.com/dp/B00LK00W5W,LEADERSHIP: Leadership NOW - The Ultimate Guide to Becoming a Great Leader for Life!: Leadership,2.99,"LEADERSHIP! Learn How to Become the Best Leader You Can Be! How does someone become a good leader? Is it through vigorous studying? Is it about reading tons of heavy and thick books about leadership? Is it being born a royalty or from a bloodline of politicians? Many people from all over the world have been through so many things just to find out how to become a great leader. Too many books have been published instructing people that they should be like this or like that so they’ll be the next great leader the world will know. Just like all the other qualities we all came to know, leadership is also a rare trait that anyone can possess. It is rare which is why many people wanted to have it but never got it. It is always a wonder why there have been so many great books about leadership but great leadership is still difficult to have. People are looking everywhere but missed looking at their selves. They seem to forget that leadership is not just the title or the person; it’s the wholeness of a person that comprises their actions, way of thinking, qualities, and their resonating charisma. All these things are the simple things that most people forget. This book contains strategies and qualities that a good leader must possess. Inside, you’ll read about the qualities of a leader that would help him in dealing with real people and real life circumstances. This book consists of 5 chapters that cover significant and important points to guide you in your quest to becoming a great leader for life. Read on and feed your mind with new information about the qualities of what a true leader really has.Here Is A Preview Of What You'll Learn... Understanding Leadership Winning Private Battles – Personal Qualities of Great Leader Relationship and Communication – Professional Qualities  Staff Management Qualities   Decision-making and Crisis Management Qualities Much, much more!Download your copy today!Take action today and download this book for a limited time discount of $2.99!"
165,B005YIR5WO,https://www.amazon.com/dp/B005YIR5WO,Sell on TV: How to Market Your Product on TV and into Retail with the Power of Infomercials / DRTV,9.99,"Does your product have what it takes to become the next $100 million success like OxiClean, the Snuggie or Pillow Pets? This easy to follow book will guide you through the process from concepting to market research to in-market profits. ""Powered by the air you breathe, activated by the water that you and I drink,"" perhaps the pervasive Billy Mays' most infamous line, started a trend that would lead to billions of dollars in sales for OxiClean.  What started on TV, soon led to Wal-Mart, Target and virtually every other retailer on the planet.  Eventually, the company that launched OxiClean was sold by the Appel family for $325 million.  You'll hear more of the OxiClean story in Chapter 1.""It's a pillow.  It's a pet.  It's a Pillow Pet!""  If you have children between the ages of 2 and 10, it's likely that you've heard them singing this tagline a few times around the house.  You probably even have a Pillow Pet or two in your home. Jennifer Telfer, the inventor of the now famous Pillow Pet started selling the stuffed animal in malls in 2008 and quickly grew to $3 million in annual revenue.  Not a bad start for a first time inventor.  Two years later, in 2010, the Pillow Pets brand earned over $300 million in annual revenue, and it's still growing.  This is a great example of how an inventor with a simple idea can turn their product into immense profits through selling on TV. And, finally, who would believe that a blanket with sleeves would ever become a national phenomenon? But that's exactly what happened when the Snuggie was first introduced as a direct response commercial (infomercial) premiering in 2008. From there, the often-mocked--but wildly successful--product has been featured on the Today show and has grown to near cult-like status among its faithful followers. What do these wildly differing products all have in common? For one, they were all initially sold on TV; and each has made its individual creators or companies millions. Chances are if you're reading a book called Sell It On TV, you're at least vaguely familiar with pet rocks and Chia Pets, Mister Microphones, OxiClean, Pillow Pets and Snuggies, to say nothing of the Clapper, the Magic Jack, Ginsu knives and the PedEgg line of in-your-face commercials.  Jon LaClare is the founder of Harvest Growth, an infomercial and DRTV consulting firm (www.HarvestGrowth.com)."
166,B006W6XPLW,https://www.amazon.com/dp/B006W6XPLW,Start a Freedom Business,0.99,"Start a Freedom Business is a collection of practical tips and information by serial entrepreneur and full time traveler, Colin Wright.This book is intended to help aspiring entrepreneurs build businesses that they can be proud of and profit from, while also avoiding the startup trap that many young business people fall prey to, which leads them to exchange a good portion of their lives (a very finite resource) for more money (something that can be earned without that horrible tradeoff).Chapters cover:What a Freedom Business is, how to start one, and why you would want to.The perspective shift that will allow you to reach your ideal lifestyle faster.Why work-life balance is not what you should be aiming for.How to focus on value instead of money, so you can reclaim more of both.The 'All or Nothing' principle.A vast array of basic business concepts.Coverage of many different Freedom Business models.Interviews with successful entrepreneurs who have build their businesses with personal freedoms and their ideal lifestyles in mind....and more!"
167,B00DT8QBFS,https://www.amazon.com/dp/B00DT8QBFS,Make Money From Home As A Google Rater (Cubicle Freedom Series),0.99,"Are you looking for a way to escape your boring cubicle job and experience the freedom of working online from home?You can make money online from home as a Google or Bing rater that can replace, or even exceed, the income from your traditional job.If you are ready to break free from that cubicle, then the Cubicle Freedom Series can give you the information that you need to make that happen.In this book, you will learn:-- what exactly a Google or Bing rater does-- what the pay rate is for this job-- who does the hiring for this job-- what the requirements are for getting hired as a rater-- what the benefits are of this job-- things you are exposed to as a rater that you may not consider-- where to find other raters onlineWhile this book is short, it gives you all the information that you need to get started as a rater. There are no images in the book to inflate the page count - just facts.Here's to YOUR cubicle freedom!"
168,B00IELU63I,https://www.amazon.com/dp/B00IELU63I,"Entrepreneurship: How To Take Your Dream and Turn It Into A Profitable, Stable Business",2.99,"You are sick and tired of other people creating a business for themselves off of your talents.  You have always yearned to find your niche, a place where you can be yourself, work hard and earn the money you need without the worry of losing your job because your employer decides you are no longer needed. The problem is how to get started. This book will provide the tools you need to turn your dream into a business."
169,B00J0DQNG8,https://www.amazon.com/dp/B00J0DQNG8,Rich Dad Education on Tax Secrets,3.99,"Do you look at your paycheck every month and shudder at the amount of money that’s taken from you in taxes? What about the amount you have to pay at the end of each fiscal year? It’s been said that taxes are one of the certainties in life; something we all have to deal with. Though this may be true, taxes don’t have to be the burden they currently are. There are ways taxes can actually be beneficial. Rich Dad Education is a financial education company dedicated to helping the average person use the same financial knowledge and strategies that the rich have traditionally kept to themselves. Rich Dad Education on Tax Secrets will introduce you to multiple ways the tax code can actually help you build wealth and keep more of your hard-earned money. If you’re sick of seeing so much of your money swallowed up by taxes each year, buy this Rich Dad Education book and learn what you can do to change that."
170,B00BMF9U5S,https://www.amazon.com/dp/B00BMF9U5S,Who's The Boss - The Employee's Bible,0.99,"If you have employees, if you have counter people, if you want an excellent training tool, WHO'S THE BOSS is it.  Are you losing customers due to employee's attitude?This is the best investment you'll ever make.  How-To handle customers!Who's The Boss is the employee's bible, a manual for success.  What's more important than recognizing who's the boss, recognizing that no business succeeds unless all involved recognize that the CUSTOMER is boss.  This little manual explains why, and why understanding that basic business premise is the path for not only the businesses success, but the employee's."
171,B00BLV5GPG,https://www.amazon.com/dp/B00BLV5GPG,How to Find Your Passion: 3 Keys to Unlock a Purpose-Filled Life,0.99,"Discover Your PassionHow to Find Your Passion: 3 Questions to Unlock a Purpose-Filled Life is a little book that deals with some of the biggest questions of our lives—the questions of who we are and who we are to become. This short manifesto of sorts, which calls the reader to discover and live in their ""element,"" is also a very practical guide that utilizes three simple questions to help lead readers to the answers for which they seek.Within the book, John Rivers emphasizes the connection between the discovery of your passions and the discovery of your purposes. In the discovery of one, he argues, there will be found the discovery of the other. So, on the one hand, this book will help guide you to where you feel most yourself, where you come alive. On the other hand, it will show you the potential of your impact on others and the way in which those in the future will look back on your legacy.A book to help you live a purpose-filled lifeClarity is key when it comes to finding your passion and unlocking a purpose-filled life, so the book's main goal is to bring clarity to where there was none before. This is accomplished through asking a series of questions and giving practical tips about how to answer those questions for yourself. By the end of the book, you will be equipped with many new tools that will help you find your passions and purposes, change the world, and leave a lasting legacy. This book is an invitation to join the masses of those who are ready to march forward in changing the world by learning how to be themselves."
172,B007PMNMW4,https://www.amazon.com/dp/B007PMNMW4,"The Happiness Spreadsheet: How To Create A Budget Aligned with Your Values, Beliefs and Ideals",2.99,"The Happiness Spreadsheet is a workbook that leads the reader step-by-step to the creation of a personalized Happiness Spreadsheet.What is a Happiness Spreadsheet?  The Happiness Spreadsheet is a budget workbook that will help you to identify what is most important to you and then how to allocate your limited resources (time and money) to bring more of those experiences and things into your life. By completing the exercises in the book you will: Identify your key values, beliefs and ideals; focus on spending in relation to those beliefs and ideals; and create a spending plan that aligns with your most cherished values while at the same time living within your means. Cathy Curtis, the author, is a CERTIFIED FINANCIAL PLANNER™ and has helped clients over the past 15 years to optimize their spending to lead more fulfilling lives. This ebook was inspired by her experiences with her clients."
173,B00FWCAW9K,https://www.amazon.com/dp/B00FWCAW9K,The PATRIOT MISSION Story,9.97,"America is on fire and deeply divided. Class warfare, hyphenated-Americans, revisionist history, political correctness, financial ignorance and hidden agendas are just a few of the issues that divide us. We have a choice. We can reject the 'new normal.' The book is not a theoretical analysis about how we got here. It is a well grounded action plan to reverse course and create a great future. The PATRIOT MISSION Story answers the most compelling question millions of people are asking: ""What can I do for America, RIGHT NOW, that will really make a difference?""The PATRIOT MISSION Story unites Americans. Every citizen, whether you are a consumer, free enterprise advocate, entrepreneur, apprentice or mentor, can be a stakeholder in this project to save our nation. This optimistic story gives us a practical blueprint to play a key role in the effort to Rebuild America through the Power of Small Business. What is the POWER of Small Business? The freedom to be an entrepreneur in America is powerful. More than 30 million Americans have taken the risk to start a small company. Their dreams create the raw energy necessary to design, market and deliver a profitable product or service in the face of a touch economy. Small business POWER crosses every cultural, social, economic and geographic boundary. Small business is an institution that touches every American in some way, every day! Think about your daily routine. How often do you patronize convenience stores, local restaurants, and professional service firms? Do you tap creative smart phone apps and surf unique websites? Many of these resources have been created by a small business owner with a dream! The PATRIOT MISSION Story will show you how we will GROW our Capital, Political Influence and Liberty in record time. Together, we will burn off the dark clouds hanging over our nation and reveal  ""The Shining City on a Hill."""
174,B00558ULUQ,https://www.amazon.com/dp/B00558ULUQ,Dancing With the Talent Stars: 25 Moves That Matter Now,9.99,"From left to right, front to back and side to side, General Mills Chief Learning Officer Kevin Wilde has made moves all over the talent management field. In this insightful book, the award-winning development leader and Talent Management columnist shares the 25 talent lessons he has learned in his 30-year career in four parts:• Learning strategies• Executive development• HR excellence• Talent managementPick up this book, get ready to tango and learn the 25 talent moves that matter now.******************************************** Reviews""Kevin Wilde has a unique and invaluable view of how to understand and manage talent."" – Dave Ulrich, Professor, Ross School of Business, University of Michigan, author of the bestseller HR Champions and HR Transformation""Leaders will find these dance steps are practical ways to get their talent troupe making magic."" – John Boudreau, Professor, Marshall School of Business, University of Southern California, author of Retooling HR and Beyond HR: The New Science of Human Capital"
175,B008FIBWWY,https://www.amazon.com/dp/B008FIBWWY,"The End of Growth Update: Europe & America Stumble, China Hits the Wall",0.99,"This is updated, supplemental text for Richard Heinberg's 'The End of Growth'. The new material reflects on the rapidly shifting global economic scenarios, bringing the book up to date as of June 2012."
176,B00BL9JKD2,https://www.amazon.com/dp/B00BL9JKD2,,,
177,B00FPXTJZ4,https://www.amazon.com/dp/B00FPXTJZ4,You Are Stronger Than You Think - The Best of Motivation from Time Management Ninja,4.99,"The hardest part of achieving a goal is getting started. What you need is motivation!You Are Stronger Than You Think – The Best of Motivation is a collection of the best and most popular motivational posts from the top rated productivity blog, Time Management Ninja, to help you get started, get motivated, and reach your goals.With tips on 10 Ways to Win with a Positive Attitude, How to Remain Calm while Others are Losing it, and 50 Ways to Out Run a Boring Life, you’ll get new insights on reaching goals, building confidence, and living the life you’ve dreamed of."
178,B00B73QU5I,https://www.amazon.com/dp/B00B73QU5I,"Saving Your Way to a Better Life: How to Budget, Pay off Debt, Save Money and Shop Smart",2.99,"Why didn’t they teach me this in school?Unless you were an accountant major, you probably didn’t learn much about finances in school and that’s one of the reasons why you may be struggling with them now. If you are living paycheck to paycheck and cannot seem to save a dime then this is the book for you. If you are unable to save because your expenses are just too high, you are not prepared for retirement or even for an emergency, and struggle with finances then you should read this book!No matter how much money you are making there are ways to save and earn extra income and that’s what this book is all about. In this simple Step by Step Guide to Saving Your Way to a Better Life, you will learn:•Tips on how to save money on everyday items and even how to get FREE stuff•How to get out of debt sooner and save at the same time•How to manage your money better and put it where it should be•How to organize your finances so that you stay on trackAnd so much more!Take this first step to saving your way to a better life! This book is meant to be a guide on your savings journey and gives you resources that go beyond just this book and continue on the author’s blog.Testimonial“Saving Your Way to a Better Life is an excellent resource loaded with great information and ideas to help begin saving money if you are at a beginner level or save more money if you have already started a plan for better managing your money”  -Anne"
179,B00JJC03RK,https://www.amazon.com/dp/B00JJC03RK,,,
180,B00BNXIYCE,https://www.amazon.com/dp/B00BNXIYCE,Web Marketing for Small Businesses: How Do You Get More Clients - The 30 Day Guide to Generating Leads (Marketing for Small Businesses: The 30 Day Guide Book 1),3.99,"Web Marketing for Small Businesses: Where Do You Get More Clients… The 30 Day Guide to Generating LeadsAs a small business owner, have you ever asked yourself: How do I get customers? Where to find prospects?  Or maybe even, Where to find clients? Well believe it or not, the above questions are all trying to accomplish one thing – get new business! Because as any business owner knows, new customers are the lifeline to their business success.This book was written as the lead generation guide for small businesses. Within its pages Kurt Lucien, a.k.a The Success Director - will show you REAL LIFE lead getting techniques, which once implemented correctly, will flood your business with new customers and ensuring lifelong fans forever!Here’s just a few things which the book covers:-  How to Treat Customers to Build Customer Loyalty  pg.9- The Way to Bring in Traffic to Your Site – Targeted Traffic pg.12- How to Generate More Leads in 30 Days Or Less pg.13- How to Find Qualified Leads pg.14- Online Social Media – How It Works to Generate Leads pg.16- How Effective Is The Internet For Lead Generation? (Internet Statistics, Social Media Stats, Twitter Stats, Facebook Stats, pg.18  - Social Media For Business Statistics pg.20- How to Use Facebook For Leads pg.24- How to Use Twitter For Leads pg. 29- How to Use LinkedIn to Gather Leads pg. 32- How to Drive Traffic Using Pinterest pg. 35- A Strategy for Using YouTube For Your Lead Generation pg.37- The 5 Ways to Entertain Your Readers And Give Them All The Information They Need pg.40This quick read is a real roadmap to success on where to get more clients, or as some would say - where to get more customers!Get your copy now."
