index,asin,url,title,price,description
244,B00D0YUCUQ,https://www.amazon.com/dp/B00D0YUCUQ,Email Marketing Blueprint - The Ultimate Guide to Building an Email List Asset,2.99,"LEARN:: Email Marketing Strategies for Kindle Publishers, Affiliate Marketers, Bloggers and Information MarketersThere's a popular expression online - ""the money is in the list"". Does that mean you should build a list and spam people with offer after offer?  Heck no. I say that the relationship is in the list.  An email list can be a vital asset to your online business — as long as you treat it with care. Subscribers are more than a collection of email addresses. They're a group of people who have a specific interest in your niche topic. Treat them right and you’ll create a lifelong asset.      In ""Email Marketing Blueprint"" you'll learn what Steve Scott has done to build engaged email lists that exceed 90,000 total subscribers. (Proof Inside!)    The Secret to Long-Term List-Building SuccessThe goal of ""Email Marketing Blueprint"" is simple:You will learn how to build an email list that gets results — no matter what market you select or what your income goals are.  You'll start by getting into the mind of subscribers, giving them what they want and then using this relationship to grow your online business. The best part? You will learn how to build connections that last for years.Another thing you'll discover is how to run an email list that generates income. So it's the perfect course for any affiliate marketer, Kindle publisher, blogger or information marketer.  If you’ve ever wanted to start a list or if you’re looking to improve your email marketing campaigns, then this is the book for you. What you'll discover is a step-by-step system to getting results with email marketing. INSIDE:: Email Marketing Blueprint - The Ultimate Guide to Building an Email List Asset""Email Marketing Blueprint"" provides the definitive overview of how to build a profitable list.    Inside this guide you'll discover:Five Pillars of Successful List BuildingWhy ""Free"" Is the Best Way to Build an Email ListThree Long-Term Email Marketing StrategiesHow to Perfectly Blend Autoresponders with Broadcast Messages12 Types of Email Marketing Messages (and When to Use Each)How ONE Page Can Build Your Email ListSix List-Building WordPress ToolsHow to Create Compelling, ""Click-Worthy"" Subject LinesHow to Time the Delivery of Email MessagesNine Crucial List-Building GuidelinesHow to Drive Traffic to an Email ListList-building doesn't have to be hard.  All you need is a step-by-step guide that walks you through the process.  Would You Like To Know More?Download now and take your email marketing campaign to the next level.Scroll to the top of the page and select the buy button."
245,B009179PJK,https://www.amazon.com/dp/B009179PJK,How to Buy Low on eBay and Sell High on Amazon (B.L.e.S.H.a.),6.99,"eBay and Amazon sellers rejoice! Now retail arbitrage (the art of buying items on eBay and then reselling them on Amazon or eBay) can be easily done from the comfort of your own home. No scanner required! The author, an eBay PowerSeller and award-winning Amazon merchant, shows you the exact steps he uses to find undervalued merchandise on eBay and then resell it for big profits (up to 125% ROI!). This book is chock-full of 'profit proof' (he shows you his receipts and records) and video tutorials."
246,B00CMZEY8A,https://www.amazon.com/dp/B00CMZEY8A,When to Apply for Social Security Retirement Benefits: Strategies for Maximizing the Guaranteed Income You Can't Outlive: UPDATED FOR NEW RULES (My Personal CFO),5.99,"UPDATED FOR THE NOVEMBER 2015 BUDGET BILL CHANGES TO SOCIAL SECURITY FILE AND SUSPEND AND RESTRICTED APPLICATIONDid you know?•Each year that one waits to collect Social Security, benefits increase by about 8 percent a year PLUS the rate of inflation. •Before reaching what's called full retirement age (66 for people nearing retirement today) there are rules reducing benefits depending on how much outside earnings people make. Those penalties disappear at full retirement age.•If you take benefits early and lose some or all of them because of Social Security's earnings test, Social Security will actuarially increase your benefits starting at your full retirement age based on the number of months of benefits you forfeited. •A married couple could be looking at a lifetime Social Security benefit in excess of $1 million.The bullet points above are just a few basic rules and information about Social Security, and yet few people are aware of these concepts.   In fact, the majority of Americans spend more time planning their next vacation than examining their options and strategies for when to begin this vital income stream. Finding a professional to provide objective advice can also prove difficult. Banks and other financial institutions don't train advisors to provide advice on claiming strategies and Social Security Administration personnel are neither trained nor allowed to give advice.  The optimal age to take Social Security retirement benefits is dependent upon a large number of interrelated and individual factors which must be considered.  You cannot assume that commonly held misconceptions such as ""You should always file as early as you can for benefits"" or ""You need to stop working to receive benefits"" are correct or represent the optimal strategy for YOU.  These one-size-fits-all answers leave many retirees failing to maximize the benefits they have earned.   Author Lisa Hay, CPA,  CFP®, combines a clear and friendly writing style with tax and financial planning expertise to provide the reader with a comprehensive overview of the myriad of factors involved in the complex decision of when to begin Social Security retirement benefits.  This book will help you construct smart claiming strategies that will enhance your lifetime income and minimize your risk of running out of money!Neither investors nor advisors can control the financial markets, but with good Social Security planning you can maximize the chances of a happy retirement. When to Apply for Social Security Retirement Benefits provides invaluable advice on how to do this. Please note that SS Book Description for When to Apply for Social Security Retirement Benefits: Strategies for Maximizing the Guaranteed Income You Can't Outlive does not cover Social Security disability benefits or Supplemental Security Income (SSI).NOTE FROM THE AUTHOR:This guide is the result of my study and my experience providing Social Security planning advice to clients. I believe that it is one of the most comprehensive, relevant tools available to ensure that you are equipped to make a well-informed decision about when to begin taking your Social Security benefits.Ultimately, my hope is that this guide will equip and inspire you to make well-informed decisions which will allow you to pursue and achieve your individual goals for your retirement years."
247,B00A6AV07G,https://www.amazon.com/dp/B00A6AV07G,The Public Speaking Gold Mine,2.99,"In 1912, the late, great Dale Carnegie first codified the ‘’rules’’ of public speaking, coaching business people in public speaking and presentation skills.  Prior to that time, there were neither ‘’rules’’ nor any recognized trainings available.In nearly a century since then, countless teachers, trainers, and courses have either taught Carnegie's rules, or attempted to improve on them.In 2006, a simple training program known as ‘’Public Speaking Gold Mine’’ changed those rules, possibly forever!The difference between just ‘’saying a few words’’ and being a fearless, persuasive, and profitable speaker is largely dependent on your understanding of a few key strategies that usually are not taught in public speaking training courses and books.  Kerry O’Hallaron’s ‘The Public Speaking Gold Mine’’ shows you how to take the maximum advantage of the knowledge, skills, and abilities you possess right now, the advantages that all super successful speakers and trainers capitalize on as a matter of daily business.You will discover a wealth of proven success techniques which you can implement immediately to exponentially increase your speaking success, income and opportunities.  This program is for speakers, trainers, teachers, preachers, business people, and entrepreneurs - and anyone else who has a message to deliver.  No matter where you are presently as a speaker or trainer, this program will show you how to get things done.In ‘’The Public Speaking Gold Mine’’ you will learn:•How to pick a niche topic that virtually guarantees success•How to quickly get more speaking opportunities than you can handle•How to turn your fear of public speaking into a passion for profits•How to transform your ‘’specialized knowledge’’ (or where to get some, if you don't have it) into a money making asset.In this exciting training program, you will learn how to make every presentation a sales presentation - whether you are selling a product, a service, an idea, a concept, or a belief.You'll be able to look at your future as a speaker, presenter, or trainer in a whole new light; one in which you use what you know to educate your audience, make them hunger for more of you, and then give them the chance to satisfy that hunger.  When you've mastered “The Public Speaking Gold Mine,’’ there will be no limit to what you can do in your speaking career."
248,B00F3LR7IE,https://www.amazon.com/dp/B00F3LR7IE,"Attract Money. NEW and REVISED Version of The practical guide on how to attract more money in 21 days. (Practical guide to money making, money management ... Joe Vitale, T.Harv Ecker, Robert Kiyosaki,)",0.99,"Finally: A Proven, Step-By-Step System To Mastering Your Money And Attracting Loads More Money to Your LifeToday only, get this Amazon bestseller for just $2.99. Regularly pricedat $4.99. Read on your PC, Mac, smart phone, tablet or Kindle device.New revised version with even more tools and techniques that will enrich your life and bring the prosperity into your life.Want more money? Stop lowering your standards and start attracting the money that will give you the freedom to achieve anything you desire. Attract Money is the perfect practical blueprint for bringing more money to your life, breaking free from debt, lack, struggle and fear. It is an easy to follow formula that will work magic for YOU.CAUTION: Reading this book is likely to open your energy to attracting. Please read carefully and put into practice starting today!Here Is A Preview Of What You'll Discover...How to master the phenomenally powerful, yet simple, methods that will take you to a limitless new reality!New ideas, motivation and extraordinary enthusiasm to change your life completelyHow to revolutionize and master your finances, career and businessDesign a compelling life that you are passionate about and motivated to go and get IT everydayUnleash your drive to propel you to the next levelRaise your standards to live the life you truly deserveHow to manifest everything you've ever wanted and dreamed ofAnd much, much more!Download your copy today!Take action today and download this book for a limited time discount of only$0.99! (insert call to action here)Tags: Attract Money Now, Practical guide to money making, money management and money makeover, Dr. Joe Vitale, T.Harv Ecker, Robert Kiyosaki, Stefan Pylarinos, Zig Ziglar, Les Brown, Steve Pavlina, Wayne Dyer, Stephen Covey, Oprah, Tony Robbins, Donald Trump"
249,B00IOW2QI0,https://www.amazon.com/dp/B00IOW2QI0,"Free Tools for Writers, Bloggers and Solopreneurs",0.99,"Are you running a freelance writing business, blog, website or other online business on a shoestring budget? This short, high-value ebook will point you in the direction of free apps, software and online tools to help with productivity, organization, social media management, content creation, and much more.By the time you finish this book you'll be able to do everything from checking your grammar, to creating an infographic, to driving free traffic to your blog or website, all using free tools, sites and downloads.The book contains links to all resources mentioned. A handy little reference guide you'll keep on your Kindle or other device to refer back to again and again."
250,B00BD6XY7G,https://www.amazon.com/dp/B00BD6XY7G,The Essential Guide To Improving Your Life With Evernote Including Secrets and Tips For Using The Evernote App,2.99,"Learn How To Optimize Every Aspect Of Your Life With The Evernote AppSince its release, Evernote has been one of the top apps in the world. Designed to make your life more organized and efficient, this free app has changed the lives of the millions who have discovered how to use it effectively. Unfortunately, understanding all of the facets and functions of this elephant app isn't always easy and can be downright frustrating. But no more! The Essential Guide To Improving Your Life With Evernote is your simple guide for learning how to maximize and personalize Evernote in order to fit your unique needs. In this ultimate guide you will learn: How Evernote WorksThe Varied Uses of EvernoteHow To Organize With EvernoteHow To Personalize EvernoteSolutions For Business And Home Using EvernoteAbout Evernote's Temporary Notebook SystemHow To Use Evernote With Social MediaAbout The Evernote ScannerHow To Increase ProductivityWhat ""The Secret Weapon"" IsAnd Tons Of Other Creative Ideas And Solutions! Your better, more productive, highly organized, awesome life awaits -- Buy The Essential Guide To Improving Your Life With Evernote Today!"
251,B00KEFZTB6,https://www.amazon.com/dp/B00KEFZTB6,,,
252,B009GNB54W,https://www.amazon.com/dp/B009GNB54W,Career Savvy - Keeping & Transforming Your Job,6.99,"If you wake up on Monday morning already dreaming of Friday but you aren’t ready to look for a new job, this book will help you discover how to take the job you have and transform it into one you love.  Keep it, change it, love it.      Career Savvy gives you the tools you need to regain control of your career and keep your job longer in hard times. This gives you the time to plan the steps you need to take to transform your job from the one you were hired for into the one you will love.  If you are ready to take a serious look at your career-limiting behaviors and attitudes and how you can change your mode of interaction to one that serves you better, this book is for you. You don’t have to change who you are; you simply need to take a good look at how you are perceived by others every day if you want to continue where you are. And if you are ready for a career change, this book will make it easier to find the job you were meant to do at the intersection of your passion and ability."
253,B007AL01HY,https://www.amazon.com/dp/B007AL01HY,The New Robber Barons,9.74,"With Trillions On the Table, Nobody Plays Fair, and Everyone Plays For Keeps The New Robber Barons, is an anthology of Janet Tavakoli’s original chiefly web-based articles from the September 2008 financial crisis through February 2012. The original commentaries are unrevised so that readers experience the real-time thought process. Some background was repeated in commentaries so that they could read as stand-alone articles as events unfolded. The eBook is for readers who do not wish to sift through web content, and who do not wish to read in print format, both of which are alternative options.The New Robber Barons’ articles pick up where her previous book, Dear Mr. Buffett, ended. Tavakoli serves up example after stunning international example of no-strings-attached socialization of losses and privatization of gains. She exposes the criminogenic environment that enabled international oligarchs to solidify power.Tavakoli’s conclusions were eventually confirmed by Congressional investigations."
254,B00HUP1RXM,https://www.amazon.com/dp/B00HUP1RXM,Time Management Techniques: 8 slick strategies to create more free time and use it as you want and end procrastination.,1.99,"If you have issues with your time management or simply wish to improve your time management skills, then 'Time Management Techniques' is your go to guide.Earl Nightingale said “You don't manage time, you manage activities” This book therefore highlights 8 essential strategies that you must do each day to generate more free time, so that you can do the things you really want to do.By studying this book, it will certainly improve your management of time and end the dreaded procrastination. You can use it as both a strategic time management tool and a useful day to day time manual.Finally, if you are figuring how to best to manage your finite time and use it more wisely, then this time management workbook will be a useful investment indeed."
255,B007GE8ZUK,https://www.amazon.com/dp/B007GE8ZUK,How to Grow Rich by Creating Multiple Streams of Residual Income (How To Create Wealth Book 1),3.99,You can find financial freedom and become seriously rich by simply understanding the phenomenal power of creating multiple streams of residual income. There is a saying that “The key to wealth and happiness in today’s world is to create multiple streams of income using diverse models and combination of passive and active income in areas where your passions and talents can be most thoroughly engaged.” Most of us start making money through a job where we trade our hours for money. The trick to real wealth is to slowly change our income source from linear or work income to residual income were money works for us. In this book bestselling author Praveen Kumar explains how to shift from linear income to creating multiple sources of residual income that will sustain your family wealth for generations. This book will explain the following vital aspects of creating multiple streams of residual income:•What is the problem with linear income and why residual income is important?•Categories of Residual Income•Steps to create residual income•Real estate as basis of residual income•Some great passive income ideas•How to create online residual income•The problems in creating multiple streams of residual income•The wrong way to create multiple streams of residual income•The right way to create multiple streams of residual income•Practical steps to creating multiple streams of residual incomeOnce you read this book you will learn how the rich create their wealth and sustain it for generations. The good part is so can you?There is a surprise gift of $300 in value inside the book.Grab this book at the introduction price before it goes up.
256,B00KXVOUD4,https://www.amazon.com/dp/B00KXVOUD4,"How To Make Money On YouTube: The Ultimate Guide to How to Make Money With YouTube Making Passive Income for Life (youtube videos, youtube strategies, ... channel, passive income for life, youtube)",4.99,"Discover How To Make Passive Income For Life On YouTubeToday only, get this Kindle Book for just $2.99. Regularly priced at $9.99. Read on your PC, Mac, smart phone, tablet or Kindle device.You’re about to discover how to create another source of income making passive income for life on YouTube. Thousands of people become unemployed each year due to shifts in the economy therefore ultimately leaving people without no source of income. Thousands of people are in need of jobs but advancement in technology over the years have replaced human labor. Most people realize how much of a problem this is but are unable to adopt to the new economy in the world we live in today simply because people do not realize other ways in obtaining income besides the same routine; getting a job. The truth is, if you are struggling to make money or have no way in doing so its because you are lacking the creativity and information needed.This book goes into a step by step proven strategy that will help you make money, creating you a source of passive income therefore helping you take control of your life and financials.Here Is A Preview Of What You'll Learn...Methods To Making Money Online Understanding How YouTube Works Google Adsense Monetizing Videos That Make You MoneyProduct MarketingAffiliate MarketingVideo Reviews Building An Audience Content CreationMuch, much more!Download your copy today!Take action right away to create a passive stream of income for the rest of your life harnessing the power of YouTube today by downloading this book ""How To Make Money On YouTube"" for a limited time discount for only $2.99!Download Today!Tags: youtube videos, youtube strategies, youtube marketing, youtube free,  youtube channel, passive income for life, youtube"
257,B00K9SPJPO,https://www.amazon.com/dp/B00K9SPJPO,"Investing In Stocks:  What You NEED To Know  To Keep Your Money,  Become Profitable And  Beat The Average Investor By Far!",2.99,"There are certain principles that great investors use to generate great profits in the stock market. When most people think about stocks, they think about them as a luxury item. The truth is, when you think about stocks you want to think about them like a basic necessity, like shopping for groceries. In this book I will show you how to make money, and even more importantly how to avoid losing money like 90% of all stock traders do. So prepare yourself to learn the real fundamentals of how stock trading really works."
258,B00789SPY4,https://www.amazon.com/dp/B00789SPY4,,,
259,B00FX3IMZY,https://www.amazon.com/dp/B00FX3IMZY,How to Design TED Worthy Presentation Slides: Presentation Design Principles from the Best TED Talks (How to Give a TED Talk Book 2),3.99,"“Reading this book changed my presentation style and my slides, both for the better - and I've been a professional speaker for over 30 years.” ~ Becki L. James “How to Design TED-Worthy Presentation Slides” is your secret to designing sexy presentationsHow to Design (and Deliver) TED-Worthy Presentation Slides is a short, practical and step-by-step guide to creating sexy slides. It is based on an extensive analysis of some of the best TED speakers, such as Brene Brown, Daniel Pink, Amy Cuddy, Larry Lessig, Seth Godin, Bill Gates and many, many more. Included in the book are sample sexy slides from TED talks, as well as from across the web, to help you master the art of presentation design.Learn how to breathe life into your slides, instead of draining it out of your audienceBy the end of this guide, you too will be able to create sexy presentation slides that keep your audiences mesmerized. More importantly, you will be able to design presentations that breathe life into your slides, instead of draining it out of your audience. Not convinced yet? Here’s just a taste of what you’ll learn inside the book:•The most common mistake most presenters make – and how you can avoid it•The one principle that will make you better than 90% of most speakers•How to quickly create a presentation storyboard•Bill Gates’ trick for transforming his slides from dull to dashing•The Seth Godin presentation formula•The importance of contrast•Locating and using sexy fonts•Spicing up your presentations with video•Displaying data without being dull•Ensuring consistency between slides•How to deliver a great TED talk (or any other speech or presentation)•And much, much more…“A must read...An essential tool for preparing effective, interesting and ""sexy"" presentations...a must read for any professional who wants to improve his communication skills.” ~ Rosalinda Scalia“The lessons shared in this short book will a go a long way to helping a person give better public presentations. The insights shared by Akash are like golden nuggets in a river full of info!” ~ Alan Portugal“I have been teaching workshops at universities and Fortune 500 Campuses up and down the East Coast on building better presentations. Akash hits all the right notes in this book. A must read for anyone wanting to build powerful presentations.” ~ David Bishop“Excellent for those who want to really engage their audience. I incorporated many of the principles within and developed a more effective product presentation.” ~ Tom Tipps“Right on the mark. Just what I was looking for as a non-designer.” ~ Erik J. Zettelmayer“Make a greater impact with your presentations. While reading this book I was mentally reviewing my talks where I use PowerPoint slides. I am now changing some of those slides to make a greater impact on the listeners. These tips are easy to implement and make sense.” ~ John C. Erdman“As always we can expect the best from Akash and we are getting more.” ~ Payam Bahrampoor“This book gives practical advice. However, it does not stop there. It demonstrates how to use that advice, gives visual examples of what to do and what not to do and explains why. It turns creating a presentation from a dreaded event to one allowing creativity to flow and your passion about your subject matter to emerge on the screen through your slides.” ~ Pandora Training and Consulting“I will admit to rarely reviewing books. However, this book was such a step above any others I've read on the art of PowerPoint presentations, I had to give it a five star review.” ~ David SchwindIf you are ready to create sexy, mesmerizing slides and make a greater impact with your presentation, then scroll up and click the ""buy now"" button to get started..."
260,B00005R2F8,https://www.amazon.com/dp/B00005R2F8,,,
